Sl No,Title,Document Link,Publishing Year,Extracted Text
3,Sexual Harassment of women at workplace prohibition Act 2013,https://cdnbbsr.s3waas.gov.in/s35d6646aad9bcc0be55b2c82f69750387/uploads/2023/02/2023021554.pdf,15.03.2023,"GOVERNMENT OF MEGHALAYA
LAW (B) DEPARTMENT
******
No.LJ(B). 114/2002/Pt/125 Dated Shillong, the 28th February, 2017.
C E R T I F I C A T E
This is to certify that the Law Department, Govenment of
Meghalaya has vetted the Legal Literacy Materials consisting of 11 booklets
and 11 folders in English Language. These material are found to be
satisfactory and would be of immense use in disseminating legal awareness
to the grassroots level in the State.
Date: 28.02.2017 ( S.K. Sangma )
Under Secretary to the Govt. of Meghalaya,
Law Department.
****Question of Dignity
It has been only the sixth year of
Hechila’s marriage and she has been
widowed. The entire responsibility of
upbringing her two children have fallen on
her shoulders. She did not even get a chance
to mourn for the demise of her husband.
Previously it was the onus of attending to
her relatives and now it is the question of
upbringing her children. Dealing with all
these, the time has come when Hechila has
to take a decision that she should get
engaged in a job.
After all, where
will she be
getting the
money to pay for
the house rent,
education of her
children and food
and clothing?
1While these questions were running
through her mind, an idea dawned in her
mind. Hechila knows the work of appliqué
very well. She started thinking that during
this tough and trying time of hers, it will be
her skill that will be of great help. Hechila
expressed her thoughts to her neighbour,
Aunt Khumla. After hearing what Hechila has
been thinking, Khumla said that she will try
to arrange for some job for her (Hechila)
after consulting with her husband.
After a few days, Khumla asked Hechila
to display some of the samples of her work
to the nearby boutique. If they like and
accept her work, she may get a chance to
work on their orders. There was a ray of
hope for Hechila. She had with her wallets,
mobile cover, purse, etc. which were
previously made by her. She opened her old
trunk and started searching for those items.
While going through the items, she came
2across her wedding dress in the trunk which
made her cry a lot. Then she consoled herself
and looked at the positive side. After all,
her children, the token of her husband are
with her. She then took out the appliqué
samples from the trunk
and proceeded
towards the kitchen
for her chores.
H e c h i l a
q u i c k l y
completed
her daily
c h o r e s
early in the
morning.
Thereafter, she proceeded towards the
address given by Aunt Khumla. She was
filled with apprehensions and mixed
thoughts. She began thinking, “What will I
do if they don’t accept my works; I don’t
3know anything apart from it. If they refuse
these works of mine, I will start preparing
tiffins. However for preparing the tiffins,
where will I get additional money to
purchase foodgrains, vegetables and
pulses? Additionally, I will also have to buy
tiffin carriers.” When all these thoughts were
running thick and fast through her mind,
she reached the boutique. She stepped into
the boutique with a lot of fear, nervousness
and apprehension.
It is for the first time in her life that she
is seeing the interior of such a beautiful
boutique. She was awestruck at the
collection of the various mekhalas, ladies
tops and shawls. Looking at all these she
started thinking, “Will I ever be able to make
such items?” At that instant, she was
suddenly intercepted by the sight of a
woman coming towards her. She was
Sangtila, the owner of the boutique. Sangtila
asked Hechila, “How may I help you?”
4Hechila narrated her sad story and
sequence of events with tearful eyes to
Sangtila and displayed the samples to her.
The samples were really beautiful. Looking
at them Sangtila said, “Don’t think that I
am doing a favour for you. You have fineness
in your hands. Don’t worry, I will provide a
job for you.” Hearing this, Hechila quietly
5thanked God. She was in disbelief that her
prayers were answered so soon.
Sangtila handed over to Hechila a
mekhala, design samples, beads, threads
and many other such materials. She also
gave her a deadline when Hechila is
supposed to complete the work and bring it
to the boutique. Thereafter, everyday in the
afternoon,
H e c h i l a
started her
work of
appliqué. As
a result, the
o u t c o m e
was such
that, Hechila completed her work before the
given date. Hechila was eagerly waiting for
her first salary. On the said deadline, she
reached the boutique and showed her work
to Sangtila. Sangtila was quite happy at
6Hechila’s work and asked Chuba, an
employee of the boutique, to pay her the
requisite amount of money.
This time Hechila took along a shawl with
her. The bigger the work, the bigger is the
money. This went on for quite a while. In
the meanwhile, Hechila admitted her
daughter in a school. Slowly she started
saving some amount of money after
meeting all her expenses. Appliqué was a
hobby of Hechila. She was happy that her
skill has helped her in the time of her need.
There were many instances when
Hechila collected her salary from Chuba
when Sangtila was not around in the
boutique. There were a number of times
when Hechila felt that Chuba stared at her
in an inappropriate manner, but she ignored
his stares. Soon there were times when
Chuba handed over her salary in such a way
that his hands touched hers. Hechila felt
7uncomfortable at all these happenings but
abstained from saying anything. She
consoled herself by thinking that these are
mere accidents.
Chuba knew about the condition of
Hechila’s family. He knew that she was a
helpless lady. Now, Chuba started calling
Hechila in the boutique when Sangtila was
not around. There were many times when
he stood extremely close to her or tried to
obstruct her way by standing at the doorway
when Hechila moved out of the boutique.
Hechila had no other options since she had
to draw her salary through Chuba only.
Hechila started getting depressed. She
started despising the actions of Chuba. At
times, she cried and wept at home alone.
At one instance, when Hechila visited the
boutique with her works, only a few workers
were present. Taking advantage of the
situation, Chuba expressed his desire to
8Hechila to
have physical
relationship
with her.
Hechila was
shocked at
this indecent
proposal of
Chuba. She
ran home
without even taking her money. She was
shivering with the fear that some kind of
crime was about to take place. She turned
pale. It was for the first time that such kind
of statement was made to her.
While Hechila was on her way to her
home, she coincidently met her neighbour,
Aunt Khumla. Hechila turned emotional when
she saw Aunt Khumla. On being asked by
Aunt Khumla the reason of Hechila being
emotional, Hechila narrated the entire
9incident that she had faced. She had fear in
her mind as to what will happen in the near
future. The next time she goes to collect
her dues, what will Chuba say and do? Being
fed up of these, she wanted to leave the
job. Aunt Khumla told her not to be scared
about this matter. If she leaves this job what
other alternative does she have? What
guarantees her that there will be no people
like Chuba in other jobs? Aunt Khumla
further said that she came across an article
in the newspaper that such kind of
unwanted and unwarranted behaviours are
punishable offences as per the law, which
Chuba deserves. Both of them then decided
that they will narrate the incident to Sangtila
so that the other ladies in the boutique will
be spared from the same harassment from
Chuba.
Sangtila’s husband held a high
designation in the Department of Police and
10hence, she was aware of such laws. Chuba
got scared at the warning given by Sangtila.
He was deeply worried about his wife and
children as to
who will be
looking after
them if he will
be put
behind bars.
He started
begging for
forgiveness
to Sangtila and said,
“Henceforth, I will not commit such an
offence in the future”.
Sangtila wanted to give Chuba a second
chance, since this was the first time that he
was found guilty of such offence. However,
to make him realise the gravity of his
offence, she wanted him to meet her
husband the next day. Having no other
alternative, Chuba agreed to do so.
11The next day, Chuba was presented
before Sangtila’s husband. Her husband
attended to the matter very seriously. He
told Chuba that in today’s world, terrible and
dreadful crime
against women
starts from
such small
incidents. The
m a t t e r
worsens by
the day.
T o d a y
women have
come out of their homes and started
working. Men should try to understand their
conditions. Men have no right to make
friendship against their wishes. For a
woman, her dignity is of the highest
importance, which even men should try to
protect.
12Sangtila warned Chuba, “This is your first
offence, so I will give you a chance to correct
and improve yourself. Henceforth, your
behaviour towards Hechila should be a
respectable one or else you will be behind
the bars.” Chuba, with regretful tears in his
eyes, asked for forgiveness from Sangtila
and Hechila.
All this while, Hechila had been listening
to all these discussions. She was surprised
that the government had introduced so
many laws for preserving the dignity of a
woman and she was not aware of any of it.
Knowing all these, a new kind of strength
kindled within herself. She is now confident
that she, along with her children, can live a
life of honour and dignity in this unknown
world. Hechila bowed to God in reverence
once again and thanked the Almighty for
his never ending grace.
————
13Provisions against Sexual
Harassment
♦
The Sexual Harassment of Women at
Workplace (Prevention, Prohibition and
Redressal) Act, 2013, came into force
on February 2013.
♦
This law is also applicable to women
working at homes (maid-servants).
♦
As per the law, the accused should be
punished within 90 days and failure to
do so by the office will attract penalty.
♦
If harassment at workplace has not
stopped or the accused are not
punished, then the punishment will
keep on becoming harsher. It may also
happen that the office may be shut
down.
♦
The accused shall be penalised up to
`50,000.
14♦
Touching/groping, displaying of ob-
scene pictures, using obscene and
lewd languages, demanding or
requesting for physical relationships are
included in sexual harassment. Any
unwanted and unwarranted acts or
behaviour are also included in sexual
harassment.
♦
It is important to notify in the workplace
that harassment of women is a
punishable offence.
♦
It is important to constitute a
committee in all workplaces where
women can complain about any act of
sexual harassment.
————
15"
4,RTI 2005,https://cdnbbsr.s3waas.gov.in/s35d6646aad9bcc0be55b2c82f69750387/uploads/2023/02/2023021514-1.pdf,15.03.2023,"GOVERNMENT OF MEGHALAYA
LAW (B) DEPARTMENT
******
No.LJ(B). 114/2002/Pt/125 Dated Shillong, the 28th February, 2017.
C E R T I F I C A T E
This is to certify that the Law Department, Govenment of
Meghalaya has vetted the Legal Literacy Materials consisting of 11 booklets
and 11 folders in English Language. These material are found to be
satisfactory and would be of immense use in disseminating legal awareness
to the grassroots level in the State.
Date: 28.02.2017 ( S.K. Sangma )
Under Secretary to the Govt. of Meghalaya,
Law Department.
****STORY ON RIGHT TO INFORMATION
The village of Chungmoi is a small one;
with roughly 50 houses and one primary
school. The school, and their teacher,
Mr. Hopong’s house are made of tin while
all the other houses in the village are thatch
roofed.
The Public Work Department (PWD),
wanting to build a road through the edge of
their village, made provisions for acquiring
the required measurements for the
development of the road. Of what land they
use for the construction of the said road,
they promised all the necessary
compensation to the affected villagers.
On the 22nd of March, there was a public
announcement in the evening stating that
the compensation money would be
distributed the following morning and that
everyone who was to receive it was to report
1to the teacher, Mr. Hopong’s house to collect
their share.
The next day, as announced, all the land
owners assembled at Mr. Hopong’s house.
Two persons accompanied the P.W.D. head
and the Sub-Divisional Officer (SDO); the
people in charge of handing out the money
sat at a table and all who were to receive
the compensation money were seated facing
them.
2Standing up, the S.D.O said, “The land
we are taking from you is unequal and
varying in size. However, the difference is
not too vast, and since calculating each and
every person’s land is all too big a task in
itself, we have taken an average on the
compen-sation amount to be paid to each
of you. We will be giving everyone here a
sum of Rs. 20,000 for his land.” “Your names
and the amount you are to receive have
been written here and each of you will have
to give his signature next to his name. If
you are unable to write, your thumb print
will be sufficient,” he continued. The people
obliged and did as instructed, with every
person receiving his share of the money.
In Chungmoi, there was a person who
was strictly against corruption. His name
was, Mr. Awang. On learning about the
method of the distribution of the
compensation money, Mr. Awang had a
hunch about it. He asked Mrs. Apoung who
3was one of the land owners who received
the compensation about the matter. She
(Mrs. Apoung) is a person who is very
particular about things. Listening attentively
to what Mrs. Apoung said, Mr. Awang
adviced her to make an inquiry on the matter
under Right To Information (RTI).
Mrs. Apoung had never heard of the concept
before. He told her the meaning and the
workings of R.T.I. He explained to her that
R.T.I (Right to Information), is a device
which enabled
citizens to have
the necessary
information on
things done by
the government
to maintain
transparency and
curb corruption.
He continued by
telling her that
4whatever inquiry made, will be answered
within a period of 30 days failure to which,
the party under inquiry will be prosecuted.
Nothing is kept secret from the public unless
it is valuable information threatening
National security.
“Thank you. After hearing what you have
said, I have a feeling that something is not
right here. I will inform the others about it
5and we shall file an R.T.I inquiry with your
help”, said Mrs. Apoung.
Then the landowners of Chungmoi village
went to the District Headquarter P.W.D Office
and searched for the Public Information
Officer (P.I.O). On finding him, they handed
him the inquiry letter and the Rs. 10 fee.
They were informed that it would take 30
days for them to receive the information.
The appellate authority of the public
authority shall dispose of the appeal within
a period of thirty days or in exceptional
cases within 45 days of the receipt of the
appeal.
After investigation, it was found out that
the landowners got only half of the allotted
money for their land compensation, and the
money to be given each person also varied
according to the size of land used for the
construction site. Also, names of people who
did not belong to the village were found
6written on the list which stated that they
were paid the money.
The amount sanctioned by the
government was Rs. 5,00,000 but what the
people of Chungmoi received was only
Rs. 2,00,000 and that to the unknown
names was Rs. 1,00,000. The missing
Rs. 2,00,000 was not recorded. The
government launched an investigation
against the culprits of this misdemeanour.
7It was found that the P.W.D Minister
pocketed Rs. 2,00,000. Their modus
operandi was such that the minister called
his subordinate officer and told him this, “For
the Government work, Rs. 2,00,000 is
required. Quickly send that money. The
remaining Rs. 3,00,000, distributed as per
your discretion.”
Of the Rs. 5,00,000, the minister took
Rs. 2,00,000, the land owners of Chungmoi
received Rs. 2,00,000, and the remaining
Rs. 1,00,000 was written off to the names
of the people who were not residents of the
village of Chungmoi. The S.D.O, their cashier
and the Minister in charge where punished
as per the law. All the money that they
wrongfully took from the people, they were
forced to repay the full amount and by the
command of the court, all the people found
guilty were put behind bars.
8After this, all the land owners of
Chungmoi received the due amount which
they were each allotted and each of them
also upgraded from their thatch roof houses
to houses with roofs made of tin. The
widowed Mrs. Apoung received the largest
amount of money. With that money, she
constructed the biggest house in their
village.
*************
**********
*******
***
9"
