Sl No,Title,Document Link,Publishing Year,Extracted Text
1,"PCPNDT Act, 1994",https://cdnbbsr.s3waas.gov.in/s35d6646aad9bcc0be55b2c82f69750387/uploads/2023/02/2023021538-1.pdf,15.03.2023,"GOVERNMENT OF MEGHALAYA
LAW (B) DEPARTMENT
******
No.LJ(B). 114/2002/Pt/125 Dated Shillong, the 28th February, 2017.
C E R T I F I C A T E
This is to certify that the Law Department, Govenment of
Meghalaya has vetted the Legal Literacy Materials consisting of 11 booklets
and 11 folders in English Language. These material are found to be
satisfactory and would be of immense use in disseminating legal awareness
to the grassroots level in the State.
Date: 28.02.2017 ( S.K. Sangma )
Under Secretary to the Govt. of Meghalaya,
Law Department.
****Sex Determination is an Offence
Chila and Khandang were the best of
friends. Both of them studied together and
grew up together. One day Chila was
engaged to get married. On hearing this
news, Khandang had mixed feelings. She
was happy as well as sad. She was happy
because her friend is going to be settled and
sad because both of them have to part from
each other owing to their upcoming new
lives.
1Within a few days Chila got married.
Whenever Chila visited her maternal home,
both Chila and Khandang used to talk for
hours. Within their talks, Chila described her
new family to Khandang while Khandang
described the recent happenings in the
village, the crops in the field and the
threshing place.
A year later, Chila came to her maternal
home for maternal care. This time she was
going to stay for a longer duration.
Khandang was delighted at this. She often
came to visit Chila.
Chila was soon blessed with a beautiful
daughter. However, her in-laws seemed a
bit unhappy. On the other side, Khandang
was extremely happy. To celebrate her
happiness, Khandang prepared some
2laddoos (sweets) and took them to the
hospital and distributed them to everyone.
Looking at this, Khandang’s mother told
Chila, “Chila, without you Khandang
becomes very depressed but whenever you
are by her side she gleams with happiness.
Why don’t you look for a suitable groom for
her and take her to your village? Thereafter,
both of you can always be together.”
3Fate took such a turn that Khandang too
got married to a person from the same
village as that of Chila. Both of them were
extremely happy. However, happiness was
not there for long. There were a lot of
restrictions in the house of the in-laws of
Khandang. She was not allowed to meet
anyone or go out of the house. Khandang
often wondered as to when she will be able
to meet Chila.
4One day both Chila and Khandang met
each other in the Church. There, both of
them decided that they will meet each other
in the Church every Sunday evening. Both
of them, then, eagerly waited for Sunday
and when they met at the Church, they
talked on a variety of topics.
One Sunday evening, when both of them
met in the Church, both of them looked sad.
Unlike the other days, both of them did not
look happy. Both of them sat at the steps of
the Church and Chila told Khandang,
“Khandang, I have something to tell you.”
“Something is also troubling me too,
Chila” said Khandang.
“Troubling you? What is troubling you?”
asked Chila.
Khandang said, “First you. Let me know
what you want to tell.”
5Chila replied, “No, first you. I would like
to solve your problem first. Tell me what is
troubling you?”
Khandang then replied, “This ‘you first’,
‘you first’ will finally lead us to the time when
we will be leaving for our homes. Alright let
me tell you what is troubling me.” She
continued, “Chila, about 4-5 days before I
was very happy, when I learnt that I am
going to become a mother. Every night I
dreamt about the child and now my mother-
in-law is about to take me to the doctor for
a sex- determination test. My mother-in-law
says that the first child should be a boy. I
know that carrying out a sex-determination
test is an offence. Do you remember that
lady doctor who told us in school that
determining the sex of the foetus is an
offence? But how will I say this to my in-
laws? What shall I do? Tell me.”
6On hearing this, Chila held her head and
said, “My God! This thing was also running
through my head. This was what I was going
to say. Do you remember that everyone was
displeased when a daughter was born to
me? Everyone was chiding me and this time
everyone in my family is asking me to go
for a sex-determination test. I am really
scared. If this time also I give birth to a
daughter, then....? Are we going to commit
this offence? Madam Doctor said that this
is a crime. We will become criminals,
Khandang.”
Khandang showed a lot of conviction and
said out rightly, “No Chila, whatever may
be, we are not going to do anything wrong.
The lady doctor from the city comes on
Mondays only. Our family members will be
taking us to her on that day. Think of
something as to how can we be saved from
this sin.”
7Both of them silently thought about this
matter. Then Chila whispered into
Khandang’s ears, “Have courage. We are
two of us here.” Thereafter, both of them
left for their own respective homes.
On Monday, Chila’s mother -in-law took
her to the hospital. While Chila was sitting
on the bench and waiting for her turn, she
was also waiting for Khandang’s arrival. A
few moments later, Khandang arrived with
her mother-in-law. The lady doctor also
arrived at the hospital after sometime. Both
Chila and Khandang were surprised to learn
that the lady doctor is the same doctor who
used to visit their school. They held each
others’ hand and saw a ray of hope. Both of
their fears vanished and they both gave a
smile of relief.
During the check up, Khandang’s
mother-in-law was present with her. So, she
8was unable to say anything. However, when
Chila got the chance, she told the doctor
what was in her mind. The doctor consoled
her and gestured to her to remain quiet.
After a while, Chila’s mother-in-law slowly
requested the doctor to carry out the sex-
determination test. However, the doctor
flatly refused to do so. The doctor also called
in Khandang’s mother-in-law. Then she
started explaining to both of them, “It is God
9who decides whether the child will be a boy
or a girl. Pre-natal sex-determination is a
punishable offence. Determination of sex of
the foetus will result in punishment for you
as well as for me....”
In the meanwhile, when the doctor was
explaining to both the mothers-in-law inside
the chamber, the two close friends hugged
each other outside with tears of joy.
10Pre-Conception and Pre-Natal
Diagnostic Techniques (Prohibition of
Sex Selection) Act, 1994, amended
2003.
A few years back, the technology for pre-
natal sex determination was developed. This
technology is useful in detecting and curing
the physical and mental defects of the child
in the womb. Moreover, with this technology
other diseases of the foetus can be detected
and the diseases can be cured.
However, this technology has been
misutilised. People have been using this
technology to determine the sex/gender of
the foetus. When people came to know that
the foetus was that of a girl, they would go
for forced abortion. As a result, the number
of female foeticide cases began to rise. Due
to this, the ratio of females to males (sex
ratio) began to fall in a rapid pace. To curb
11with the dwindling sex ratio and
misutilisation of the technology, an Act was
enacted. The Act is known as The Pre-
Conception and Pre-Natal Diagnostic
Techniques (Prohibition of Sex Selection)
Act, 1994, as amended in 2003. As per the
provisions of this Act, any laboratory,
testing/examination centre or clinic is
restricted from determining the sex of the
foetus. According to this Act, determination
of the sex of the foetus is allowed only in
certain special conditions.
Pre-Natal Diagnostic Tests are
considered legal only in the following
conditions:
♦
The child in the womb has chromosomal
irregularity/abnormality.
♦
The pregnant woman has undergone two
or more spontaneous abortions.
12♦
The age of the pregnant woman is above
35 years.
♦
The pregnant woman had been exposed
to potentially teratogenic agents such as
drugs, radiation, infection or chemicals,
which may result in physical deformities
or mental retardation of the child.
♦
The pregnant woman or her spouse has
a family history of mental retardation or
physical deformities such as, spasticity
or any other genetic disease
Penalties as per the Act
♦
If any person goes for sex determination
test wilfully or under pressure, then he
or she will be deemed as guilty. The
penalties for the offence is imprisonment
for a term which may extend to 3 years
or with fine which may extend to
Rs. 10,000/- or both.
13♦
Any person engaged in determination of
the sex of the foetus or any person who
owns a test/examination centre and
contravenes any of the provisions of the
Act or rules thereunder shall be punishable
with imprisonment for a term not
extending 3 years or with fine which may
extend to Rs. 10,000/- or both.
♦
On subsequent conviction, the offender
will be punishable with imprisonment
extending to 5 years and with fine which
may extend to Rs. 50,000/-.
♦
After carrying out the test of determining
the sex of the foetus, if the medical
practitioner or the compounder reveals
the sex of the foetus, it is deemed as
criminal conduct and they too can be
booked under this Act.
♦
If the offence is made by a doctor/
medical practitioner, it may result in
14suspension of the registration and
removal of his name from the register of
the Council (State Medical Council) for a
period of 5 years for the first offence and
permanently for the subsequent offence.
♦
Advertisements on pre-natal sex
determination are also unlawful and illegal.
Any person or organisation involved in
such advertisement shall be punishable
with imprisonment for a term not
extending 3 years or with fine which may
extend to Rs. 10,000/-.
M.T.P. Act, 1971 (Medical Termination
of Pregnancy)
♦
Sex determination or medical
termination of pregnancy after
determination is an offence. However,
medical termination of pregnancy is legal
under certain circumstances.
15♦
These circumstances are in consonance
with MTP Act, 1971 (Medical Termination
of Pregnancy Act, 1971). Under this Act,
medical termination of pregnancy can be
carried out only within 12 weeks of
pregnancy. Only under the following
circumstances, medical termination of
pregnancy may be carried out if :
 the pregnancy is fatal for the mother.
 conception is due to rape.
 conception is due to failure of family
planning techniques or
 the unborn child has abnormalities/
deformities.
♦
Medical termination of pregnancy should
be within 12 weeks of pregnancy. Under
special circumstances, medical
termination of pregnancy can be carried
out up to 20 weeks of pregnancy on the
16advice of 2 doctors. Medical termination
of pregnancy is not possible after the fifth
month of pregnancy.
What We Can Do
♦
We should not indulge in pre-natal sex
determination in our families.
♦
We should also advise our relatives,
friends and neighbours to abstain from
pre-natal sex determination.
♦
If any women in the vicinity seem to be afraid
or under pressure to carry out pre-natal sex
determination, we should reach out to help
her.
♦
Doctors should pledge that they will
never indulge in the crime of female
foeticide.
♦
If we notice any such kind of activity in
our vicinity, then we should immediately
inform the Health Department.
17♦
We should have discussions in the
society to change our attitude towards
the girl child.
♦
At village level gatherings/assemblies,
we should take resolutions to save the
girl child.
♦
We should spread awareness among all
village folks to stop female foeticide.
♦
All young girls should be prepared with
the mindset that they will not indulge in
the crime of pre-natal sex determination
in their future lives.
*******
18"
2,RTE,https://cdnbbsr.s3waas.gov.in/s35d6646aad9bcc0be55b2c82f69750387/uploads/2023/02/2023021527.pdf,15.03.2023,"GOVERNMENT OF MEGHALAYA
LAW (B) DEPARTMENT
******
No.LJ(B). 114/2002/Pt/125 Dated Shillong, the 28th February, 2017.
C E R T I F I C A T E
This is to certify that the Law Department, Govenment of
Meghalaya has vetted the Legal Literacy Materials consisting of 11 booklets
and 11 folders in English Language. These material are found to be
satisfactory and would be of immense use in disseminating legal awareness
to the grassroots level in the State.
Date: 28.02.2017 ( S.K. Sangma )
Under Secretary to the Govt. of Meghalaya,
Law Department.
****(Sepila’s School)
The construction activities of various high rise
structures and buildings were going on in full
swing in the city. The parents of Sepila work in
these sites and Sepila migrated to the city along
with them. As a result, she had to leave behind
her small village and her school. Sepila had just
begun her education in school. She was beginning
to read and understand small short stories. Along
with them, other families of the village and their
children also migrated to the city. As the parents
and other elders were engaged as workers in the
construction sites, the children’s group spent their
time in fun and frolic. For the first few days, the
children were extremely happy since they were
all living a carefree life.
After the passage of 10 – 15 days, Sepila
asked her mother, “Mom, when will you be granted
leave? When will I return to school?”
1Her mother replied, “When the entire building
will be completed, we will return to our village.
Then you can go to your school.”
Sepila went back to her friends and got
involved with their fun and games. The next day,
when all the children were playing, a lady
approached them. The lady asked all the children,
“Why don’t you all go to school?”
The children replied, “Our school is in the
village which is very far from here. We are only
staying here for a few days.”
2The lady smiled and asked, “Okay, will you
all not take me to your home?”
The children replied, “Why not? Of course we
all will take you to our homes.” The children then
escorted the lady to their homes. The lady talked
about all the children with their parents. She
explained to them that they should send their
children to the nearest school.
Sepila’s mother said, “Madam, Sepila was
actually asking the question as to when will she
return to school. However we are strangers to
3this place. How can we enrol our children in a
school in this place?”
The lady replied that she was currently a
teacher of the nearby school. She said, “Now, it
is the responsibility of the government to provide
education to all the children in the age group of 6
(six) to 14 (fourteen) years. To enforce this, the
‘Right to Education Act’ has been enacted. All of
you can enrol your children in the nearest school.
Sepila’s mother said, “We do not have any
documents with us.” To this, the lady replied,
4“You do not need any documents to enrol your
children in the school. For enrolling your children,
you neither need to pay any fees nor incur any
expenditure. Come to our school tomorrow
itself.”
Sepila was extremely delighted to hear all
these. She said, “Wow mom! My school came
here along with me!”.
5The Right of Children to Free and
Compulsory Education Act, 2009
The Government of India has enacted the
“Right of Children to Free and Compulsory
Education Act” in the year 2009. This Act ensures
the right to free and compulsory primary school
education to all children. This right is applicable
to all the boys and girls equally of the age group
of 6 (six) to 14 (fourteen) years.
Meaning of Primary Education
Primary education starts from Class I up to
Class VIII. The Free and Compulsory Education
Act, 2009 ensures the right to admission of
children in the age group of 6 (six) to 14 (fourteen)
years in the nearest school in the town or village.
According to the Act, certain percentage of seats
is reserved in each class in private schools. These
reserved seats are meant for enrolment of
children from Scheduled Castes (SC), Scheduled
Tribes (ST), Other Backward Classes (OBC) and
the under privileged members of the society.
6Education should be free and compulsory to
all children. No fees should be charged from
children of Class I to Class VIII till the completion
of their primary education. Books, text – books/
study materials and uniforms should be provided
to all the children, free of cost.
Who shall be the Beneficiaries of this
Law?
♦
This Act is uniformly applicable for children in
the age group of 6 (six) to 14 (fourteen)
years. Special provisions have been made for
Scheduled Castes (SC), Scheduled Tribes
(ST), socially and economically backward
classes and children with disabilities.
♦
If any child above the age of 6 (six) years has
not taken admission in school previously or
have not completed his or her studies, then
he or she can be admitted in the class in
respect to his or her age. However, he or she
will be prepared for his or her lessons of the
previous classes.
7♦
If any child is admitted to school after the
age of 6 (six) years, then he or she can
continue his or her primary education after
the age of 14 (fourteen) years also.
Provisions of Admission in Other Schools
in case of Transfer
If any child happens to shift or move to a new
place, then he or she has the right to admission
in a government school near his or her new
residence. There are also provisions that the child
8may be admitted in the new school without any
documents.
System of the School
♦
It is the duty of the government to establish
schools to implement the Right to Education
Act.
♦
For children of Classes I to V, schools are to
be established within a radius of 1 (one)
kilometre.
♦
For children of Classes VI to VIII, schools are
to be established within a radius of 3 (three)
kilometres.
♦
There should be no discrimination and
misbehaviour/ maltreatment in admitting
children from the poor and under-privileged
sections of the society.
Duties of the State Government
♦
To provide free and compulsory primary
education to the children in the age group of
6 (six) to 14 (fourteen) years.
9♦
To establish schools nearby. If required,
vehicle should be provided for children with
disabilities.
♦
Special attention should be given to the
children of weaker sections of the society.
There should be no discrimination with them
in class, with drinking water, with food and in
playing ground. They should not be involved
in cleaning the classroom and toilets.
♦
To maintain proper records of children in the
age group of 6 (six) to 14 (fourteen) years
nearby. To enrol children in the age group of
6 (six) to 14 (fourteen) years in schools. To
put their names in the notice boards.
♦
Proper attention should be given in matters
of enrolment of the children in to the school,
attendance of the children and studies of the
children.
♦
Schools are to be provided with proper
buildings, teachers and teaching aids.
10♦
Training for the teachers should be provided
in regular intervals.
♦
Admission should be granted to outstation
children.
♦
Security issues and complaints of the children
should be looked into and solved.
♦
To provide the right of equality to the weaker
sections of the society.
Duty of Parents and Guardians
It is the duty of parents and guardians to admit
their children or wards in neighbouring schools.
Managing Committee of the School
A body or committee is to be formed for
managing the affairs of the school which will be
known as the Managing Committee. This
committee is not formed in private schools. Three
fourth (¾) of the members of the committee shall
be parents and guardians as representatives. This
committee shall consist of 50% women. The in
11charge of the Committee shall be from amongst
the parents or guardians of the children.
Roles and Responsibilities of the
Managing Committee of the School
♦
Monitor the working of the school.
♦
Prepare developmental programme(s)/
scheme(s) for the school.
♦
Ensure proper utilisation of school funds.
♦
Assist in the proper functioning of the activities
of the school.
Schemes for Development of the School
The Managing Committee shall prepare the
schemes for development as per the requirement
of the school. While doing so, the condition or
status of the school should be considered. As per
the development schemes, the government shall
provide financial assistance for the free
distribution of books/ text books and uniforms to
the children. There will be provisions for training
of teachers. The committee shall provide
12suggestions to the government for the issues
related to the development of the school. There
will also be provisions for attending to complaints
and for resolving them.
♦
It is a punishable offence if any school
takes admission fees or any other
charges during admission. No interview
shall be conducted for the students or parents
during admission of the child. Any such
practice shall attract a penalty in the form of
a fine of Rs. 25,000/- (Rupees Twenty Five
Thousand only).
♦
If a child does not have any document of proof
of age, then he or she cannot be denied
admission in the school.
♦
If any child goes for admission or enrolment
in the school after the school has been started,
then he or she cannot be denied admission.
♦
No child can be detained in any class or asked
to leave the school until he or she completes
primary education.
13♦
No child shall be harassed mentally or/and
physically.
Provisions for Pre-School Education
♦
It is the duty of the state government to
provide pre-schooling studying facilities to the
children in the age group of 3 (three) to 6
(six) years.
Duties of the Teachers
♦
Obeying the rules and regulations of the
school like starting classes on time and being
in school on time.
♦
Completing the syllabus within the stipulated
time.
♦
Understanding the ability of every child and
taking extra care of weak children and
teaching them separately as per their
requirements.
♦
Conducting regular meetings of teachers with
the parents/guardians and apprising them of
the progress of the child.
♦
Not engaging in any private tuition.
14Facilities Available under the Right to
Education Act
1. Number of teachers in school:
For Class I to Class V
Number of Students Number of Teachers
Up to 60 2
61 – 90 3
91 – 120 4
121 – 200 5
150 and above 5 + 1 (Head Master)
200 and above Student : Teacher ratio
should not exceed
40:1 (Excluding the
Head Master)
15For Class VI to VIII
♦
There should be one teacher for each class.
Subject teachers should be in the following
manner:
(i) Science and Mathematics
(ii) Social Studies
(iii) Language
♦
For every 35 (thirty five) students, there
should be 1 (one) teacher, i.e.,
Student:Teacher ratio should be 35:1.
♦
If the number of students is more than 100
(one hundred), then there should be:
o One full-time Head Master
o Part-time teacher
o Arts teacher
o Health and Physical Training teacher
o Work Education Teacher
2. In the school building, there should be at
least one room for all the teachers and one room
should be reserved for office or stores.
16♦
Separate toilets for boys and girls
♦
Playground for the children.
♦
Provision for safe drinking water for all the
children.
♦
Kitchen for preparing mid-day meals. The
mid-day meals should be made available to
the children free of cost.
♦
Adequate security of the school building
should be ensured with proper boundary walls
or fencing.
3. The number of days that the school should
remain open and the duration of study hours are
pre-determined under this Act.
♦
For Class I up to Class V : 200 days and 800
hours.
♦
For Class VI up to class VIII : 220 days and
1000 hours.
4. Free copies and text-books will be
provided to the children in each class.
175. There should be a library in each school,
wherein newspapers, magazines, story books and
subject books should be present.
6. Each class shall be provided with sports
goods and material games.
7. To ensure that the teachers of the school
devote maximum of their time in teaching, they
will be relieved from other miscellaneous
activities.
Syllabus and Evaluation
 The syllabus should be prepared taking into
consideration the physical mental and overall
development of the children.
 The children should be able to read and write
in their own mother tongue.
 There should be development of the
reasoning power of the children.
 Evaluation of the children should be along
with teaching.
 No board examination should be conducted
up to Class VIII.
18 Certificates should be awarded to each child
after completion of primary education (Class
1 to VIII).
Where and Whom to File Complaints?
Complaints related to Right to Education will
be addressed by “Rajya Baal Adhikar Sanrakshan
Aayog” (State Child Rights Protection
Commission).
Any person can file a complaint regarding
violation of child rights to the concerned local
authority. The concerned local authority shall act
on the complaint as soon as possible.
If a person is not satisfied with the decision
passed by the local authority, then he or she can
appeal to the “Rajya Baal Adhikar Sanrakshan
Aayog” (State Child Rights Protection
Commission).
If any school violates any of the provisions of
the Act, then that school will be derecognised.
— — —
19"
